{
  "eventId": "11111111-1111-4111-8111-111111111111",
  "schemaVersion": 1,
  "occurredAtUtc": "2026-08-31T12:00:00.000Z",
  "source": {
    "service": "people-service",
    "aggregateType": "person",
    "aggregateId": "22222222-2222-4222-8222-222222222222",
    "aggregateVersion": 1
  },
  "relationship": {
    "type": "reports_to",
    "subjectId": "22222222-2222-4222-8222-222222222222",
    "beforeId": null,
    "afterId": "33333333-3333-4333-8333-333333333333"
  },
  "accessEffect": "grant"
}
