{
  "eventId": "77777777-7777-4777-8777-777777777777",
  "schemaVersion": 1,
  "occurredAtUtc": "2026-08-31T12:03:00.000Z",
  "source": {
    "service": "people-service",
    "aggregateType": "department",
    "aggregateId": "88888888-8888-4888-8888-888888888888",
    "aggregateVersion": 4
  },
  "relationship": {
    "type": "department_manager",
    "subjectId": "88888888-8888-4888-8888-888888888888",
    "beforeId": "33333333-3333-4333-8333-333333333333",
    "afterId": "33333333-3333-4333-8333-333333333333"
  },
  "accessEffect": "none"
}
